can i switch from this account to a silver one,accountChange,Change your Account
how do i change my account to a student account,accountChange,Change your Account
How do I downgrade my joint account to a non paying account?,accountChange,Change your Account
how do I switch my account,accountChange,Change your Account
How do I upgrade my account,accountChange,Change your Account
how long until i get the cash for switching,accountChange,Change your Account
I am going to university and would like to upgrade my account,accountChange,Change your Account
i am thinking of switching banks,accountChange,Change your Account
I'd like to change my platinum account services,accountChange,Change your Account
"I switched banks, when will the bonus be applied?",accountChange,Change your Account
I had made a switch to natwest and wanted to check if I get the bonus payout,accountChange,Change your Account
I have a platinum account and want to downgrade it,accountChange,Change your Account
I have a silver account and want an upgrade,accountChange,Change your Account
"im interested in a black account, upgrade from my Platinum account what are the added value benefits",accountChange,Change your Account
i'm still waiting for my switch bonus?,accountChange,Change your Account
I need a different kind of account,accountChange,Change your Account
I want a different kind of acct,accountChange,Change your Account
I want to change my account,accountChange,Change your Account
I want to change my account to you,accountChange,Change your Account
I want to convert my account to a silver account,accountChange,Change your Account
I want to convert my account to a student account,accountChange,Change your Account
I want to convert my premium to a basic,accountChange,Change your Account
I want to downgrade my account to a non paying account,accountChange,Change your Account
I want to move my account,accountChange,Change your Account
I want to open a current account with you I have an account with halifax,accountChange,Change your Account
I want to swap banks,accountChange,Change your Account
I want to switch into you,accountChange,Change your Account
I want to update my premium account to a basic account,accountChange,Change your Account
I want to upgrade my account,accountChange,Change your Account
Can you confirm the requirements for the switch bonus,accountChange,Change your Account
I was wondering how I change my account to a student account,accountChange,Change your Account
I would like to down grade my account,accountChange,Change your Account
I would like to upgrade my account,accountChange,Change your Account
may i switch my account to a new one,accountChange,Change your Account
I need to alter my account to a new one,accountChange,Change your Account
i recently switched to natwest could you confirm when I will receive the bonus,accountChange,Change your Account
I saw a new account advertised and I would like to change mine into that,accountChange,Change your Account
how can i change an account type,accountChange,Change your Account
how can i change my platinum account to a select account,accountChange,Change your Account
how can I upgrade my account,accountChange,Change your Account
how can i can change my current account to a different one,accountChange,Change your Account
downgrade my account,accountChange,Change your Account
did i qualify for the switch cash incentive,accountChange,Change your Account
change my packaged account to a regular no fee account,accountChange,Change your Account
change my packaged account to a regular account,accountChange,Change your Account
change my packaged account to a non paying account,accountChange,Change your Account
you told me my account would be switched within 7 days but this hasn't happened,accountChange,Change your Account
why hasn't my account been switched over,accountChange,Change your Account
when will i receive my switching bonus?,accountChange,Change your Account
when will i get my money for switching banks,accountChange,Change your Account
when do i get my switch bonus,accountChange,Change your Account
when am i due to get the money incentive for switching,accountChange,Change your Account
What is the progress on my account switching,accountChange,Change your Account
want to upgrade to an account with overdraft facility,accountChange,Change your Account
Switch offer not received yet,accountChange,Change your Account
need to change to a different account,accountChange,Change your Account
My main account is with HSBC but I would like to move it all over to NatWest,accountChange,Change your Account
my account should have switched over by now,accountChange,Change your Account
can I change my account as I still have a young one,accountChange,Change your Account
can i change my packaged account to a regular no fee account,accountChange,Change your Account
can I downgrade my account to,accountChange,Change your Account
can i switch from this account to a platinum one,accountChange,Change your Account
can i switch from this current account to a black one,accountChange,Change your Account
can I update my account into a new one that I saw,accountChange,Change your Account
can I update my account to a different one,accountChange,Change your Account
bank switch incentive,accountChange,Change your Account
i want to close my business account,accountClosure,Close your Account
Can you cancel the account I have with you?,accountClosure,Close your Account
Can you close my account,accountClosure,Close your Account
Can you close my account?,accountClosure,Close your Account
Can you close my bank account?,accountClosure,Close your Account
Can you help me cancel my fixed rate account?,accountClosure,Close your Account
Can you help me close out my account?,accountClosure,Close your Account
can you please cancel this account,accountClosure,Close your Account
close business account,accountClosure,Close your Account
close credit card account,accountClosure,Close your Account
close my account,accountClosure,Close your Account
close myrewards account,accountClosure,Close your Account
Could I cancel my savings account?,accountClosure,Close your Account
delete my account,accountClosure,Close your Account
delete select account,accountClosure,Close your Account
how can I close my account,accountClosure,Close your Account
how can i close my credit card account,accountClosure,Close your Account
how can I close my joint account,accountClosure,Close your Account
how do i cancel my credit card in the app,accountClosure,Close your Account
How do I cancel my platinum services account,accountClosure,Close your Account
how do i close a joint current account,accountClosure,Close your Account
how do i close my account,accountClosure,Close your Account
How do I close my fixed rate account?,accountClosure,Close your Account
how do i close my online account,accountClosure,Close your Account
How do I get my account closed,accountClosure,Close your Account
how to go about closing a joint savings account,accountClosure,Close your Account
i am looking to cancel my credit card account,accountClosure,Close your Account
I am wanting to close my account,accountClosure,Close your Account
I'd like to cancel my fixed rate account,accountClosure,Close your Account
I'd like to close my bank account,accountClosure,Close your Account
I'd like to close my credit card account,accountClosure,Close your Account
I'd like to shut down my account please,accountClosure,Close your Account
I have an account I want to close,accountClosure,Close your Account
I have an account with you that needs closing,accountClosure,Close your Account
I need to cancel my account,accountClosure,Close your Account
I need to cancel my business account,accountClosure,Close your Account
I need to cancel my credit card via the mobile app,accountClosure,Close your Account
I need to close an account,accountClosure,Close your Account
I need to close my platinum account,accountClosure,Close your Account
I need to close my savings account,accountClosure,Close your Account
I need to get my account closed,accountClosure,Close your Account
I want account closure,accountClosure,Close your Account
I want cancellation of an account,accountClosure,Close your Account
I want my account closing,accountClosure,Close your Account
I want the cancellation of an account,accountClosure,Close your Account
I want to cancel my account,accountClosure,Close your Account
I want to close an account and all personal details,accountClosure,Close your Account
I want to close my account,accountClosure,Close your Account
I want to close my account with you,accountClosure,Close your Account
I want to close my credit card,accountClosure,Close your Account
I want to close my fixed rate account,accountClosure,Close your Account
i want to close my instant access account,accountClosure,Close your Account
I want to close my savings account,accountClosure,Close your Account
i want to completely close my account,accountClosure,Close your Account
I want to shut down an account,accountClosure,Close your Account
I want you to close out my account,accountClosure,Close your Account
I wish to close out my account,accountClosure,Close your Account
I would like to cancel my account,accountClosure,Close your Account
I would like to cancel my credit card,accountClosure,Close your Account
i would like to cancel my credit card and close my account,accountClosure,Close your Account
I would like to close my account,accountClosure,Close your Account
I would like to close the account,accountClosure,Close your Account
Please arrange the closure of my account,accountClosure,Close your Account
Please close my bank account,accountClosure,Close your Account
Please shut down this account,accountClosure,Close your Account
stop my account as I would like to close it down,accountClosure,Close your Account
wish to close my savings account,accountClosure,Close your Account
Can I close my savings account?,accountClosure,Close your Account
Can I cancel my account?,accountClosure,Close your Account
cancel my credit card accounts,accountClosure,Close your Account
Cancel my bank account,accountClosure,Close your Account
cancel credit card account,accountClosure,Close your Account
arrange cancellation of an account,accountClosure,Close your Account
can i close the credit card on the mobile app,accountClosure,Close your Account
Where can I get my bank account details,accountInfo,Account Information
can i find my account number on my debit card,accountInfo,Account Information
can you give me my iban number,accountInfo,Account Information
can you tell me my account number,accountInfo,Account Information
Can you tell me what kind of account I have,accountInfo,Account Information
can you tell me when i opened my bank account please,accountInfo,Account Information
can you tell me where I can find the sort code and the account number,accountInfo,Account Information
forgotten my account details,accountInfo,Account Information
help me find my iban,accountInfo,Account Information
How can I find my account information,accountInfo,Account Information
How can I find my bank account information,accountInfo,Account Information
how can I get my account number,accountInfo,Account Information
how do I find out my account number,accountInfo,Account Information
how do I find out my account number without my online banking,accountInfo,Account Information
how do i get a swift code,accountInfo,Account Information
How do I get my card details,accountInfo,Account Information
How do I get my SWIFT code,accountInfo,Account Information
How do I locate my SWIFT code,accountInfo,Account Information
I am trying to find my iban,accountInfo,Account Information
I can not find my iban,accountInfo,Account Information
I can not see my iban,accountInfo,Account Information
i can't find my account number for my new account,accountInfo,Account Information
"I don't have a bank statement, where can I find my account number",accountInfo,Account Information
I have been asked to provide the bank's bic and iban numbers,accountInfo,Account Information
i have forgotten my sort code,accountInfo,Account Information
i need iban number for a payment,accountInfo,Account Information
i need my account number,accountInfo,Account Information
I need my SWIFT code,accountInfo,Account Information
"I need my SWIFT, where do I get it",accountInfo,Account Information
I need to find my account number,accountInfo,Account Information
I need to find my account number to get back into online banking,accountInfo,Account Information
I need to locate my swift code to send money,accountInfo,Account Information
is my account number on the paper statement,accountInfo,Account Information
I want my bank wire details,accountInfo,Account Information
i want my debit card details,accountInfo,Account Information
misplaced my account number,accountInfo,Account Information
on what date did I open my account,accountInfo,Account Information
Tell me my iban and bic number is,accountInfo,Account Information
what date was my account opened,accountInfo,Account Information
What is an iban number,accountInfo,Account Information
what is my account number and sort code,accountInfo,Account Information
what is my iban,accountInfo,Account Information
what is the bic,accountInfo,Account Information
What is your swift code,accountInfo,Account Information
what's a swift code,accountInfo,Account Information
What's my account number,accountInfo,Account Information
what's my bic number,accountInfo,Account Information
what's my iban,accountInfo,Account Information
what type of account do i have,accountInfo,Account Information
when did i open my account,accountInfo,Account Information
When did I open my current account,accountInfo,Account Information
Where can I find my account number,accountInfo,Account Information
where can I find my bic or iban,accountInfo,Account Information
where can i find my iban number,accountInfo,Account Information
where can I find the bic number?,accountInfo,Account Information
where can I get my sort code,accountInfo,Account Information
Where can I get my SWIFT code,accountInfo,Account Information
Where can I locate my iban and bic numbers,accountInfo,Account Information
where can I see my bic and iban on online banking,accountInfo,Account Information
Where do I find my SWIFT code,accountInfo,Account Information
where is my SWIFT code,accountInfo,Account Information
how long does it take to show my new account on my online account,accountNotShowing,Account Not Showing
How do i set up my business account on mobile banking,accountNotShowing,Account Not Showing
how do i add other accounts,accountNotShowing,Account Not Showing
how do I add on my other account,accountNotShowing,Account Not Showing
how do i add my other accounts to my app,accountNotShowing,Account Not Showing
how do i add my credit card to online banking,accountNotShowing,Account Not Showing
how do I add my account,accountNotShowing,Account Not Showing
how do i add another account,accountNotShowing,Account Not Showing
How do I add a new account onto my app,accountNotShowing,Account Not Showing
How do I add a new account from my other bank onto my app,accountNotShowing,Account Not Showing
How do I add an account that is not showing?,accountNotShowing,Account Not Showing
how do i add a business to my mobile app,accountNotShowing,Account Not Showing
how do i add a business to my app,accountNotShowing,Account Not Showing
Can you add another account on this app,accountNotShowing,Account Not Showing
account missing from online banking,accountNotShowing,Account Not Showing
why won't the app let me add my business?,accountNotShowing,Account Not Showing
why is my credit card still not showing,accountNotShowing,Account Not Showing
why is my account no longer showing on online banking,accountNotShowing,Account Not Showing
why are my credit cards not showing on this app,accountNotShowing,Account Not Showing
when does a new account show on the account summary page,accountNotShowing,Account Not Showing
when does a new account show online,accountNotShowing,Account Not Showing
want to add another account to my app,accountNotShowing,Account Not Showing
The credit card account I'm trying to access isn't showing,accountNotShowing,Account Not Showing
the app isn't showing my credit card,accountNotShowing,Account Not Showing
new Account not showing on mobile app,accountNotShowing,Account Not Showing
my savings accounts has been removed from my banking app,accountNotShowing,Account Not Showing
my Mobile app does not show all the account,accountNotShowing,Account Not Showing
My MasterCard account has disappeared from my app,accountNotShowing,Account Not Showing
my current account isn't showing in digital banking,accountNotShowing,Account Not Showing
My current account is missing from my online banking,accountNotShowing,Account Not Showing
my credit card is not available on my app,accountNotShowing,Account Not Showing
my credit card has disappeared off my app,accountNotShowing,Account Not Showing
my credit card has disappeared from my app,accountNotShowing,Account Not Showing
My credit card has disappeared from my account,accountNotShowing,Account Not Showing
my credit card doesn't show on my list,accountNotShowing,Account Not Showing
My credit card details aren't linked to my account. Can this be corrected,accountNotShowing,Account Not Showing
My app is missing my account,accountNotShowing,Account Not Showing
my account isn't showing on my digital banking,accountNotShowing,Account Not Showing
my account isn't showing in my app,accountNotShowing,Account Not Showing
My account is not showing,accountNotShowing,Account Not Showing
my account is missing from my app,accountNotShowing,Account Not Showing
my account has disappeared from online banking,accountNotShowing,Account Not Showing
my account has been removed my banking app,accountNotShowing,Account Not Showing
mobile banking's not accepting my other business,accountNotShowing,Account Not Showing
linking savings account to app,accountNotShowing,Account Not Showing
I want to set my savings account up on my app,accountNotShowing,Account Not Showing
I want to see my business account on my app,accountNotShowing,Account Not Showing
I want to add my other account to the mobile app,accountNotShowing,Account Not Showing
I want to add my account to the natwest app,accountNotShowing,Account Not Showing
i've got a new account. when will it show in my digital banking,accountNotShowing,Account Not Showing
I've got a new account how do I add it onto my app,accountNotShowing,Account Not Showing
I've got an account that i can't add to the app,accountNotShowing,Account Not Showing
it's not accepting my other business,accountNotShowing,Account Not Showing
i opened an account earlier and it isn't on my online banking,accountNotShowing,Account Not Showing
i opened an account before and it isn't showing on my digital banking. why,accountNotShowing,Account Not Showing
i opened an account and it isn't on my app,accountNotShowing,Account Not Showing
i'm trying to add my business but getting an error,accountNotShowing,Account Not Showing
I'm trying to add my business account to the app,accountNotShowing,Account Not Showing
"I'm trying to access my credit card account, but it's not showing",accountNotShowing,Account Not Showing
I'm not able to add my business on the app,accountNotShowing,Account Not Showing
I'm getting an error when trying to add my business account,accountNotShowing,Account Not Showing
I'm getting an error when trying to add my business,accountNotShowing,Account Not Showing
I have another account that I want to add to the app,accountNotShowing,Account Not Showing
i have another account can this be added to the app,accountNotShowing,Account Not Showing
i can't view my savings account,accountNotShowing,Account Not Showing
i can't view my account details on the app,accountNotShowing,Account Not Showing
I can't see my savings account at the bottom of my account,accountNotShowing,Account Not Showing
i can't see my new account on my online banking,accountNotShowing,Account Not Showing
i can't see my credit card on my app anymore why is this,accountNotShowing,Account Not Showing
I can�۪t see my credit card on my app anymore,accountNotShowing,Account Not Showing
i can't see my account on the app,accountNotShowing,Account Not Showing
i can't see my account details on the app,accountNotShowing,Account Not Showing
I can't see all of my accounts on the Mobile App,accountNotShowing,Account Not Showing
I cannot see one of my accounts on the app,accountNotShowing,Account Not Showing
I cannot see my account in the Mobile app,accountNotShowing,Account Not Showing
I am trying to add my business account to my app,accountNotShowing,Account Not Showing
Help me view my loan balance,balance,Balance Enquiry
How can I see how far in my overdraft I am,balance,Balance Enquiry
what is my credit card balance,balance,Balance Enquiry
What is my loan balance,balance,Balance Enquiry
What is my overdraft balance,balance,Balance Enquiry
show my balance,balance,Balance Enquiry
My balance says minus but i have a overdraft,balance,Balance Enquiry
know my balance,balance,Balance Enquiry
I would like to know the actual balance on my account,balance,Balance Enquiry
I would like to know how much I have in my account,balance,Balance Enquiry
I would like to check my account balance,balance,Balance Enquiry
I want to view my loan balance,balance,Balance Enquiry
I want to see my balance,balance,Balance Enquiry
I want to know my exact balance including overdraft,balance,Balance Enquiry
I want to find my account balance,balance,Balance Enquiry
i want to check my credit card balance,balance,Balance Enquiry
Is my balance included with my overdraft,balance,Balance Enquiry
I need to know my balance,balance,Balance Enquiry
i need to find how much I have in my account,balance,Balance Enquiry
I need to check my balance,balance,Balance Enquiry
I need my current account balance,balance,Balance Enquiry
I'm trying to find the balance of my account,balance,Balance Enquiry
I'm looking to find my balance,balance,Balance Enquiry
I'd like to know the balance of my account,balance,Balance Enquiry
I am looking for my overdraft balance,balance,Balance Enquiry
How much money is in my overdraft,balance,Balance Enquiry
how much money do i have left on my overdraft,balance,Balance Enquiry
How much is my account in overdraft,balance,Balance Enquiry
How much do I have in my account excluding my overdraft,balance,Balance Enquiry
How much am I in my overdraft,balance,Balance Enquiry
How do I see my balance,balance,Balance Enquiry
How can I see the balance,balance,Balance Enquiry
Am I currently in overdraft,balance,Balance Enquiry
Are you able to tell me how much money is in my account,balance,Balance Enquiry
Can I find the balance in my current account,balance,Balance Enquiry
Can I view my loan balance,balance,Balance Enquiry
Can you confirm my account balance,balance,Balance Enquiry
Can you tell me account balance including overdraft,balance,Balance Enquiry
Can you tell me how far in my overdraft I am,balance,Balance Enquiry
Can you tell me my balance,balance,Balance Enquiry
Can you tell me my overdraft balance,balance,Balance Enquiry
check my balance on the website,balance,Balance Enquiry
Check my overdraft balance,balance,Balance Enquiry
Does my account balance shown include my overdraft,balance,Balance Enquiry
Do I have any funds in my account?,balance,Balance Enquiry
do I have any money on my account,balance,Balance Enquiry
Excluding the overdraft how much balance do I have,balance,Balance Enquiry
finding my balance,balance,Balance Enquiry
give me account balance including overdraft,balance,Balance Enquiry
How can I find out how much is left on my overdraft,balance,Balance Enquiry
view credit card balance,balance,Balance Enquiry
view my account balance,balance,Balance Enquiry
view my loan balance,balance,Balance Enquiry
what is my balance,balance,Balance Enquiry
what is todays balance,balanceAvailability,Balance Avilability
Whats balance and available,balanceAvailability,Balance Avilability
what's my available balance,balanceAvailability,Balance Avilability
why is my balance wrong,balanceAvailability,Balance Avilability
Whats the difference between balance and todays balance,balanceAvailability,Balance Avilability
when money comes in its gets deducted,balanceAvailability,Balance Avilability
why are my balances not updating,balanceAvailability,Balance Avilability
Why are my balances showing as different amounts,balanceAvailability,Balance Avilability
why do i have two different balances and what they both mean,balanceAvailability,Balance Avilability
Why do I have unavailable funds in my account,balanceAvailability,Balance Avilability
why I have different amount of money available,balanceAvailability,Balance Avilability
why is amount available different to current account balance,balanceAvailability,Balance Avilability
why is my account not showing an up to date balance,balanceAvailability,Balance Avilability
Why is my balance available so small,balanceAvailability,Balance Avilability
why is my balance lower than I expect,balanceAvailability,Balance Avilability
What is my available balance,balanceAvailability,Balance Avilability
what is available funds,balanceAvailability,Balance Avilability
what does todays balance mean,balanceAvailability,Balance Avilability
what are my available funds,balanceAvailability,Balance Avilability
wage went in last night why do i have less in my account,balanceAvailability,Balance Avilability
there something not right with my bank account. its lower than expected,balanceAvailability,Balance Avilability
There�۪s a large discrepancy between my balance and available,balanceAvailability,Balance Avilability
There�۪s a discrepancy between my available funds and my balance,balanceAvailability,Balance Avilability
